{
  "schema_version": "1.0.0",
  "content_version": "2026.08.27",
  "pack_id": "job-offers",
  "title": "Job Offers",
  "locale": "en-AU",
  "source": "migrated from lib/question_bank.dart",
  "questions": [
    {
      "id": "job-offers-001",
      "prompt": "You are seeking a job; you’ll get a job message with a high-rate payment, like below. What will you send back? Please select your answer.",
      "options": [
        "YES",
        "NO",
        "Ignore/ report the message"
      ],
      "correct_indices": [
        2
      ],
      "explanation": "If the salary sounds too good to be true, it usually is. Always research before replying.",
      "asset_image": "assets/Jobs/image01.png",
      "red_flag_rules": []
    },
    {
      "id": "job-offers-002",
      "prompt": "“This is your manager. Please purchase immediately 500 gift cards with a value of $500 and e-mail me the code.” What are the best actions?",
      "options": [
        "Purchase the cards face or lose your job",
        "Response by requesting that gift card",
        "Dial your manager on his/her official number",
        "Share this message with your colleagues"
      ],
      "correct_indices": [
        2
      ],
      "explanation": "Scammers impersonate bosses to put pressure on them. Never use unofficial   numbers and always confirm using official numbers.",
      "asset_image": null,
      "red_flag_rules": []
    },
    {
      "id": "job-offers-003",
      "prompt": "“Congratulations! You won 1000 vouchers as a reward for your hard work! Click here to claim.” What should you do?",
      "options": [
        "Click the link to view the prize",
        "Report or block the number",
        "Insert your information to check whether it is real or not",
        "Call the phone number in the message to confirm."
      ],
      "correct_indices": [
        1
      ],
      "explanation": "In the real world, companies do not provide prizes at random. Such a link can be used to get phished or malware.",
      "asset_image": null,
      "red_flag_rules": []
    },
    {
      "id": "job-offers-004",
      "prompt": "You find a site that offers sneakers at 80% off, bank transfer is the sole method of payment",
      "options": [
        "Make purchases before it is finished selling",
        "Request customer care about PayPal.",
        "Review and payment safety in check and then make decision.",
        "Believe the offer since it is on social media"
      ],
      "correct_indices": [
        2
      ],
      "explanation": "The absence of safe payment systems such as PayPal or credit cards is also a good warning.",
      "asset_image": null,
      "red_flag_rules": []
    },
    {
      "id": "job-offers-005",
      "prompt": "Which answer would you prefer?Facebook post: Two times money today, hit your two times money today, in case you invest",
      "options": [
        "Transfer small test amount",
        "Request their licensed/ registration number",
        "Introduce friends who are interested in crypto",
        "Ignore the post and move"
      ],
      "correct_indices": [
        1
      ],
      "explanation": "Crypto currency scams are also characterized by promises of high returns, guaranteed.",
      "asset_image": null,
      "red_flag_rules": []
    },
    {
      "id": "job-offers-006",
      "prompt": "On LinkedIn someone writes to you “Google is in urgent need of employees. No interview required. All you need to do is to send in your ID and bank details and get on boarded.”",
      "options": [
        "Send the ID to prove your identity",
        "Ask for an official job posting link",
        "Ignore it because it’s too much effort",
        "Give partial bank details to test them"
      ],
      "correct_indices": [
        1
      ],
      "explanation": "Why is this suspicious? Always interviews are necessary in big companies, Recruiters do not request bank information or use personal email first",
      "asset_image": null,
      "red_flag_rules": []
    },
    {
      "id": "job-offers-007",
      "prompt": "You are offered a remote assistant job. “We’ll send you a cheque for $2000. Make a deposit, collect your salary and send the rest to our supplier.”",
      "options": [
        "Deposit the cheque and follow instructions",
        "Refuse the offer and block communication",
        "Ask for smaller payment to rest",
        "Send the money and then do a follow-up with the bank"
      ],
      "correct_indices": [
        1
      ],
      "explanation": "Fake cheque scams get you liable to bounced funds. Never send money back.",
      "asset_image": null,
      "red_flag_rules": []
    },
    {
      "id": "job-offers-008",
      "prompt": "A company gives you a cheque of $3000 prior to you even beginning to work and requests you to remit a portion of its back to the company. Do you believe that this is safe?",
      "options": [
        "Yes",
        "No"
      ],
      "correct_indices": [
        1
      ],
      "explanation": "This is a scam of overpayment/ take cheque",
      "asset_image": null,
      "red_flag_rules": []
    },
    {
      "id": "job-offers-009",
      "prompt": "A recruiter you that you are chosen to work on a paid internship, however, you must purchase software license first, which costs $250. Is this normal?",
      "options": [
        "Yes",
        "No"
      ],
      "correct_indices": [
        1
      ],
      "explanation": "Real internships offer needed equipment, and do not expect purchasers to do so.",
      "asset_image": null,
      "red_flag_rules": []
    },
    {
      "id": "job-offers-010",
      "prompt": "Fill in the blanks. You got an e-mail concerning a new job opportunity. They request initial charges to train. It is a textbook scam of a type. Choices: ................",
      "options": [
        "Job offers scam",
        "Advance fee scam"
      ],
      "correct_indices": [
        1
      ],
      "explanation": "Any adviser type scheme will first demand funds and then offer employment to you",
      "asset_image": null,
      "red_flag_rules": []
    },
    {
      "id": "job-offers-011",
      "prompt": "Is this email genuine?",
      "options": [
        "Yes",
        "No"
      ],
      "correct_indices": [
        1
      ],
      "explanation": "Google only uses@google.com emails. Fake domain and request for bank \tdetails are red flags.",
      "asset_image": "assets/Jobs/image02.png",
      "red_flag_rules": []
    },
    {
      "id": "job-offers-012",
      "prompt": "What is the biggest red flag here?“You’ve been selected for a part-time job. To start, pay a $50 training fee.”",
      "options": [
        "The offer came via social media",
        "Asking for a training fee",
        "The job is part-time",
        "The message is friendly"
      ],
      "correct_indices": [
        1
      ],
      "explanation": "Real jobs never ask you to pay upfront.",
      "asset_image": null,
      "red_flag_rules": []
    },
    {
      "id": "job-offers-013",
      "prompt": "What are the red flags?",
      "options": [
        "Requesting ID copy",
        "Requesting credit card photo",
        "Offering job immediately without interview ",
        "Contacting on WhatsApp"
      ],
      "correct_indices": [
        0,
        1,
        2
      ],
      "explanation": "No real employer needs personal ID or card details via messaging apps",
      "asset_image": "assets/Jobs/image03.png",
      "red_flag_rules": []
    },
    {
      "id": "job-offers-014",
      "prompt": "Is this email genuine?",
      "options": [
        "Yes",
        "No"
      ],
      "correct_indices": [
        0
      ],
      "explanation": "The email is from the official@google.com domain, and it directs you to \tthe company’s verified careers portal",
      "asset_image": "assets/Jobs/image04.png",
      "red_flag_rules": []
    },
    {
      "id": "job-offers-015",
      "prompt": "Is this a legitimate Unilever domain?",
      "options": [
        "Yes",
        "No"
      ],
      "correct_indices": [
        0
      ],
      "explanation": "Unilever uses@unilever.com. Fake domains with extra words are scams",
      "asset_image": "assets/Jobs/image05.png",
      "red_flag_rules": []
    },
    {
      "id": "job-offers-016",
      "prompt": "What signs show this is a genuine recruiter?",
      "options": [
        "Verified LinkedIn recruiter badge",
        "Provides official company careers page ",
        "Requests for personal bank info ",
        "Pressures you to act immediately"
      ],
      "correct_indices": [
        0,
        1
      ],
      "explanation": "Verified recruiters always link to official company portals and never ask for sensitive info directly.",
      "asset_image": "assets/Jobs/image06.png",
      "red_flag_rules": []
    },
    {
      "id": "job-offers-017",
      "prompt": "Which parts are suspicious?",
      "options": [
        "Asking for credit card ",
        "High weekly salary",
        "Mystery shopper jobs are real",
        "No interview or screening"
      ],
      "correct_indices": [
        0,
        1,
        3
      ],
      "explanation": "Real companies pay via secure payroll, not credit card",
      "asset_image": "assets/Jobs/image07.png",
      "red_flag_rules": []
    },
    {
      "id": "job-offers-018",
      "prompt": "What’s the most dangerous red flag?",
      "options": [
        "Hired without interview ",
        "Contacting on LinkedIn",
        "Microsoft is a big company",
        "Message looks professional"
      ],
      "correct_indices": [
        0
      ],